{
  "planPath": "docs/plans/implement-architect-command.md",
  "planName": "Implementation Plan: /architect Command",
  "createdAt": "2025-12-23T04:36:56.666Z",
  "lastUpdatedAt": "2025-12-24T05:35:42.520Z",
  "currentPhase": "Phase 1: Core Command Setup",
  "tasks": [
    {
      "id": "1.1",
      "phase": "Phase 1: Core Command Setup",
      "description": "1.1 Create `/architect` command file at `.claude/commands/architect.md`",
      "status": "pending"
    },
    {
      "id": "1.2",
      "phase": "Phase 1: Core Command Setup",
      "description": "1.2 Add YAML frontmatter with configuration:",
      "status": "pending"
    },
    {
      "id": "1.3",
      "phase": "Phase 1: Core Command Setup",
      "description": "1.3 Write base command prompt with sections:",
      "status": "pending"
    },
    {
      "id": "1.4",
      "phase": "Phase 1: Core Command Setup",
      "description": "1.4 Define default parameters:",
      "status": "pending"
    },
    {
      "id": "1.5",
      "phase": "Phase 1: Core Command Setup",
      "description": "1.5 Create output directory structure: `docs/architecture/`",
      "status": "pending"
    },
    {
      "id": "1.6",
      "phase": "Phase 1: Core Command Setup",
      "description": "1.6 Implement artifact discovery logic:",
      "status": "pending"
    },
    {
      "id": "2.1",
      "phase": "Phase 2: Sub-Command Implementation - Core (P0)",
      "description": "2.1.1 Create `/architect:system` command file at `.claude/commands/architect/system.md`",
      "status": "pending"
    },
    {
      "id": "2.2",
      "phase": "Phase 2: Sub-Command Implementation - Core (P0)",
      "description": "2.1.2 Implement interactive requirement gathering:",
      "status": "pending"
    },
    {
      "id": "2.3",
      "phase": "Phase 2: Sub-Command Implementation - Core (P0)",
      "description": "2.1.3 Implement C4 Context diagram generation:",
      "status": "pending"
    },
    {
      "id": "2.4",
      "phase": "Phase 2: Sub-Command Implementation - Core (P0)",
      "description": "2.1.4 Implement C4 Container diagram generation:",
      "status": "pending"
    },
    {
      "id": "2.5",
      "phase": "Phase 2: Sub-Command Implementation - Core (P0)",
      "description": "2.1.5 Generate artifacts:",
      "status": "pending"
    },
    {
      "id": "2.6",
      "phase": "Phase 2: Sub-Command Implementation - Core (P0)",
      "description": "2.2.1 Create `/architect:components` command file at `.claude/commands/architect/components.md`",
      "status": "pending"
    },
    {
      "id": "2.7",
      "phase": "Phase 2: Sub-Command Implementation - Core (P0)",
      "description": "2.2.2 Implement component decomposition logic:",
      "status": "pending"
    },
    {
      "id": "2.8",
      "phase": "Phase 2: Sub-Command Implementation - Core (P0)",
      "description": "2.2.3 Implement relationship mapping:",
      "status": "pending"
    },
    {
      "id": "2.9",
      "phase": "Phase 2: Sub-Command Implementation - Core (P0)",
      "description": "2.2.4 Implement interface definition:",
      "status": "pending"
    },
    {
      "id": "2.10",
      "phase": "Phase 2: Sub-Command Implementation - Core (P0)",
      "description": "2.2.5 Generate artifacts:",
      "status": "pending"
    },
    {
      "id": "3.1",
      "phase": "Phase 3: Sub-Command Implementation - Data & Deployment (P1)",
      "description": "3.1.1 Create `/architect:data` command file at `.claude/commands/architect/data.md`",
      "status": "pending"
    },
    {
      "id": "3.2",
      "phase": "Phase 3: Sub-Command Implementation - Data & Deployment (P1)",
      "description": "3.1.2 Implement data store analysis:",
      "status": "pending"
    },
    {
      "id": "3.3",
      "phase": "Phase 3: Sub-Command Implementation - Data & Deployment (P1)",
      "description": "3.1.3 Implement data flow mapping:",
      "status": "pending"
    },
    {
      "id": "3.4",
      "phase": "Phase 3: Sub-Command Implementation - Data & Deployment (P1)",
      "description": "3.1.4 Implement data governance design:",
      "status": "pending"
    },
    {
      "id": "3.5",
      "phase": "Phase 3: Sub-Command Implementation - Data & Deployment (P1)",
      "description": "3.1.5 Generate artifacts:",
      "status": "pending"
    },
    {
      "id": "3.6",
      "phase": "Phase 3: Sub-Command Implementation - Data & Deployment (P1)",
      "description": "3.2.1 Create `/architect:deployment` command file at `.claude/commands/architect/deployment.md`",
      "status": "pending"
    },
    {
      "id": "3.7",
      "phase": "Phase 3: Sub-Command Implementation - Data & Deployment (P1)",
      "description": "3.2.2 Implement infrastructure design:",
      "status": "pending"
    },
    {
      "id": "3.8",
      "phase": "Phase 3: Sub-Command Implementation - Data & Deployment (P1)",
      "description": "3.2.3 Implement deployment pipeline design:",
      "status": "pending"
    },
    {
      "id": "3.9",
      "phase": "Phase 3: Sub-Command Implementation - Data & Deployment (P1)",
      "description": "3.2.4 Implement operations design:",
      "status": "pending"
    },
    {
      "id": "3.10",
      "phase": "Phase 3: Sub-Command Implementation - Data & Deployment (P1)",
      "description": "3.2.5 Generate artifacts:",
      "status": "pending"
    },
    {
      "id": "4.1",
      "phase": "Phase 4: Sub-Command Implementation - ADR System (P1)",
      "description": "4.1.1 Create `/architect:adr` command file at `.claude/commands/architect/adr.md`",
      "status": "pending"
    },
    {
      "id": "4.2",
      "phase": "Phase 4: Sub-Command Implementation - ADR System (P1)",
      "description": "4.1.2 Implement ADR template initialization:",
      "status": "pending"
    },
    {
      "id": "4.3",
      "phase": "Phase 4: Sub-Command Implementation - ADR System (P1)",
      "description": "4.1.3 Implement decision capture workflow:",
      "status": "pending"
    },
    {
      "id": "4.4",
      "phase": "Phase 4: Sub-Command Implementation - ADR System (P1)",
      "description": "4.1.4 Implement consequences documentation:",
      "status": "pending"
    },
    {
      "id": "4.5",
      "phase": "Phase 4: Sub-Command Implementation - ADR System (P1)",
      "description": "4.1.5 Implement ADR relationships:",
      "status": "pending"
    },
    {
      "id": "4.6",
      "phase": "Phase 4: Sub-Command Implementation - ADR System (P1)",
      "description": "4.1.6 Generate artifact:",
      "status": "pending"
    },
    {
      "id": "4.7",
      "phase": "Phase 4: Sub-Command Implementation - ADR System (P1)",
      "description": "4.1.7 Update architecture.md:",
      "status": "pending"
    },
    {
      "id": "5.1",
      "phase": "Phase 5: Sub-Command Implementation - Security (P2)",
      "description": "5.1.1 Create `/architect:security` command file at `.claude/commands/architect/security.md`",
      "status": "pending"
    },
    {
      "id": "5.2",
      "phase": "Phase 5: Sub-Command Implementation - Security (P2)",
      "description": "5.1.2 Implement threat modeling:",
      "status": "pending"
    },
    {
      "id": "5.3",
      "phase": "Phase 5: Sub-Command Implementation - Security (P2)",
      "description": "5.1.3 Implement security controls design:",
      "status": "pending"
    },
    {
      "id": "5.4",
      "phase": "Phase 5: Sub-Command Implementation - Security (P2)",
      "description": "5.1.4 Implement compliance mapping:",
      "status": "pending"
    },
    {
      "id": "5.5",
      "phase": "Phase 5: Sub-Command Implementation - Security (P2)",
      "description": "5.1.5 Generate artifact:",
      "status": "pending"
    },
    {
      "id": "6.1",
      "phase": "Phase 6: Artifact Schema Implementation",
      "description": "6.1.1 Implement `architecture.md` template with YAML frontmatter:",
      "status": "pending"
    },
    {
      "id": "6.2",
      "phase": "Phase 6: Artifact Schema Implementation",
      "description": "6.1.2 Implement 12 standard sections:",
      "status": "pending"
    },
    {
      "id": "6.3",
      "phase": "Phase 6: Artifact Schema Implementation",
      "description": "6.2.1 Implement `components.json` JSON schema:",
      "status": "pending"
    },
    {
      "id": "6.4",
      "phase": "Phase 6: Artifact Schema Implementation",
      "description": "6.2.2 Implement JSON schema validation:",
      "status": "pending"
    },
    {
      "id": "6.5",
      "phase": "Phase 6: Artifact Schema Implementation",
      "description": "6.3.1 Implement ADR template with YAML frontmatter:",
      "status": "pending"
    },
    {
      "id": "6.6",
      "phase": "Phase 6: Artifact Schema Implementation",
      "description": "6.3.2 Implement standard ADR sections:",
      "status": "pending"
    },
    {
      "id": "6.7",
      "phase": "Phase 6: Artifact Schema Implementation",
      "description": "6.4.1 Ensure all artifacts include:",
      "status": "pending"
    },
    {
      "id": "6.8",
      "phase": "Phase 6: Artifact Schema Implementation",
      "description": "6.4.2 Implement artifact linking:",
      "status": "pending"
    },
    {
      "id": "7.1",
      "phase": "Phase 7: Mermaid Diagram Implementation",
      "description": "7.1.1 Implement C4 Context diagram generation:",
      "status": "pending"
    },
    {
      "id": "7.2",
      "phase": "Phase 7: Mermaid Diagram Implementation",
      "description": "7.1.2 Add diagram styling:",
      "status": "pending"
    },
    {
      "id": "7.3",
      "phase": "Phase 7: Mermaid Diagram Implementation",
      "description": "7.2.1 Implement C4 Container diagram generation:",
      "status": "pending"
    },
    {
      "id": "7.4",
      "phase": "Phase 7: Mermaid Diagram Implementation",
      "description": "7.2.2 Add container details:",
      "status": "pending"
    },
    {
      "id": "7.5",